title,villa_name,unit_number,description,address,city,state,zip_code,latitude,longitude,bedrooms,bathrooms,max_guests,nightly_rate,booking_url,ical_url,has_direct_booking,status,is_featured,featured_image,property_types,amenities
Luxury Oceanfront Beach House,Ocean Vista Villa,209A,"Wake up to the sound of waves in this newly renovated 4BR/3BA home right on North Topsail Beach.","123 Ocean Blvd",North Topsail Beach,NC,28460,34.4291,-77.6847,4,3,10,450,https://booking.example.com/ocean-vista,https://cal.example.com/ocean-vista.ics,1,active,1,villa-featured-2.png,House,"Pool,Ocean View,WiFi"
Coastal Condo with Pier View,Pier Point Condo,301B,"Modern 2BR condo steps from the fishing pier and local shops.","234 Pier Ave",North Topsail Beach,NC,28460,34.4285,-77.6852,2,2,4,250,https://booking.example.com/pier-point,,0,active,0,villa-featured-3.png,Condo,"Ocean View,WiFi"
Pet-Friendly Cottage,Coastal Cottage,105C,"Charming 3BR cottage with fenced yard, perfect for families and pets.","345 Coastal Dr",North Topsail Beach,NC,28460,34.4278,-77.6845,3,2,5,200,,,0,active,0,villa-featured-4.png,Cottage,"Pet Friendly,WiFi"
Resort-Style Villa with Pool,Paradise Villa,401A,"Spacious villa with resort amenities and private pool.","456 Resort Ln",North Topsail Beach,NC,28460,34.4295,-77.6840,5,4,12,600,https://booking.example.com/paradise,https://cal.example.com/paradise.ics,1,active,1,villa-feature-1R.png,House,"Pool,Hot Tub,WiFi"
Modern Apartment Near Attractions,Surf City Studio,201B,"1BR apartment close to shops, restaurants, and the beach.","567 Main St",Surf City,NC,28445,34.4270,-77.6855,1,1,2,175,,,0,active,0,Bedroom1.png,Apartment,"Ocean View,WiFi"
Seaside Bungalow with Deck,Deck House,102A,"Cozy bungalow with large deck and ocean breeze.","678 Seaside Rd",Topsail Beach,NC,28445,34.4265,-77.6850,2,2,4,225,,,0,active,0,Kitchen1.png,Cottage,"Pool,Ocean View,WiFi"
